{
  "$schema": "./phase8_5_capability_matrix.schema.json",
  "schema_version": "1.0",
  "snapshot_date": "2026-08-28",
  "authority": [
    "Accepted ADRs, with later accepted ADRs narrowly superseding earlier mechanisms",
    "Frozen Phase 0-8 and V1 contracts",
    "docs/governance/historical/PHASE_8_5_COMPLETE_IMPLEMENTATION_PLAN.md",
    "Current source code as runtime fact",
    "Historical gate/evaluation reports only for the behavior they actually demonstrated"
  ],
  "state_semantics": {
    "code_present": "The required domain/interface implementation exists; this alone is not support.",
    "configured": "An enabled, valid, exact provider/profile and policy configuration exists.",
    "provider_ready": "The provider and required local/external resources passed capability checks; null means not applicable.",
    "generation_present": "A persisted generation/projection exists; null means the capability has no generation.",
    "generation_active": "A validated READY generation is atomically selected; null means not applicable.",
    "exposed_http": "A compatible production HTTP adapter exposes the capability.",
    "exposed_mcp": "A compatible production MCP tool/resource exposes the capability.",
    "discoverable": "An unfamiliar client can infer availability, intended use, bounds, and chaining from public metadata.",
    "behaviorally_verified": "End-to-end behavior, not only class/direct-call conformance, passed for this exact snapshot.",
    "security_verified": "The applicable authorization, isolation, cursor, resource, and injection matrix passed.",
    "certified": "ADR-0070 governance approved this exact runtime/profile/generation/scope. No unsupported PASS is permitted.",
    "implication_rule": "No true state implies any later state. certified requires every applicable earlier state true."
  },
  "runtime_mapping": {
    "declared": "A matrix capability row exists; code_present separately records implementation availability.",
    "configured": "Maps directly to states.configured.",
    "buildable": "Computed at runtime from code presence, exact profile registration, and service construction; it is not inferred from a persisted matrix boolean.",
    "ready": "Computed at runtime from successful provider/service probes and, where applicable, a READY generation.",
    "active": "Computed at runtime from ready state plus explicit activation and active-generation selection; generation-backed activation maps additionally to states.generation_active.",
    "exposed": "Maps to the applicable states.exposed_http and states.exposed_mcp transport snapshots.",
    "verified": "Maps to states.behaviorally_verified and states.security_verified as independent evidence dimensions.",
    "certified": "Maps directly to states.certified and is never inferred by the runtime."
  },
  "frozen_v1": {
    "contracts": [
      "canonical document/version/source/chunk identities",
      "canonical Chunk.text and digest",
      "StorageInterfaceV1 pre-ADR-0072 method set",
      "V1 FTS, embeddings, retrieval plans, ranking and reranking",
      "V1 citations and Final-QA including ADR-0054 and ADR-0056",
      "V1 HTTP and streaming semantics",
      "the original six MCP tool semantics",
      "Qdrant optionality"
    ],
    "known_drift": "ADR-0072 added list_sources_for_document to StorageInterfaceV1; WP-14 completed ADR-0075 migration to DocumentScopeResolverV1 and restored the frozen protocol while preserving notebook propagation and fail-closed resolution.",
    "storage_interface_v1_pre_0072_methods": [
      "open", "close", "health_check", "capabilities", "put_asset", "get_asset",
      "delete_asset", "put_parsed_document", "get_parsed_document", "contains_hash",
      "upsert_document", "get_document", "get_document_by_content_hash", "list_documents",
      "delete_document", "upsert_notebook", "get_notebook", "delete_notebook",
      "list_notebooks", "upsert_source", "get_source", "delete_source", "list_sources",
      "upsert_note", "get_note", "delete_note", "list_notes", "upsert_insight",
      "get_insight", "delete_insight", "list_insights", "upsert_session", "get_session",
      "list_sessions", "append_turn", "list_turns", "upsert_citation",
      "get_citations_for_turn", "delete_session", "upsert_entity", "upsert_edge",
      "get_entity", "find_entities", "get_related_entities", "delete_graph_for_document",
      "upsert_chunks", "get_chunk", "delete_chunks_for_document", "search_dense",
      "search_sparse", "delete_document_cascade"
    ]
  },
  "capabilities": [
    {
      "id": "canonical_ingestion", "owner": "KnowledgeEngine ingestion pipeline", "dependencies": ["parser registry", "chunker", "embedding provider", "StorageInterfaceV1"],
      "storage_or_index": ["canonical documents/versions/sources/chunks", "FTS/title", "V1 embeddings"], "http": ["V1 source ingestion"], "mcp": [],
      "readiness_conditions": ["configured parser/chunker/embedder/storage", "indexed lifecycle complete"], "completeness": "Per-document ingestion integrity; not retrieval completeness.",
      "security": ["input bounds", "notebook/source authorization", "transactional publication"], "certification_requirements": ["Phase 0-8 corpus regression", "parser/chunker/identity invariants"],
      "states": {"code_present": true, "configured": true, "provider_ready": true, "generation_present": null, "generation_active": null, "exposed_http": true, "exposed_mcp": null, "discoverable": true, "behaviorally_verified": true, "security_verified": true, "certified": true},
      "evidence": ["Phase 0-8 certification", "Phase 8.5.11 ingestion report"], "gap": "No WP-00 gap; frozen behavior."
    },
    {
      "id": "v1_retrieval", "owner": "V1 retrieval/query services", "dependencies": ["canonical FTS/title", "V1 embeddings", "reranker"],
      "storage_or_index": ["canonical FTS/title", "V1 vector cache/backend"], "http": ["/v1/search", "/v1/query", "/v1/query/stream"], "mcp": ["search_all_notebooks", "query_notebook"],
      "readiness_conditions": ["V1 configuration and indexes ready"], "completeness": "Bounded ranked top-k; never exhaustive.", "security": ["notebook scope", "source/document/version attribution"],
      "certification_requirements": ["frozen regression", "direct protocol validation"],
      "states": {"code_present": true, "configured": true, "provider_ready": true, "generation_present": true, "generation_active": true, "exposed_http": true, "exposed_mcp": true, "discoverable": true, "behaviorally_verified": true, "security_verified": true, "certified": true},
      "evidence": ["Phase 0-8 certification", "current V1 routes/tools", "WP-03 MCP contract tests"], "gap": "No WP-03 gap; metadata now states non-exhaustive bounds without changing V1 semantics."
    },
    {
      "id": "exact_retrieval", "owner": "DocumentExpansionServiceV2 and additive ExactDocumentReaderV1", "dependencies": ["document scope", "exact version"],
      "storage_or_index": ["canonical chunks/parsed blocks/original reference"], "http": ["V2 delivery routes", "POST V2 document expand"], "mcp": ["get_document", "get_document_chunk"],
      "readiness_conditions": ["authorized exact version", "bounded delivery service", "exact parsed representation and exact chunk reader"], "completeness": "Complete only at terminal exact selector/snapshot; unavailable positions remain unavailable.", "security": ["version and notebook authorization", "selector/snapshot/bounds cursor binding", "cursor reauthorization"],
      "certification_requirements": ["exact/full traversal", "blind-agent selector behavior"],
      "states": {"code_present": true, "configured": true, "provider_ready": null, "generation_present": null, "generation_active": null, "exposed_http": true, "exposed_mcp": true, "discoverable": true, "behaviorally_verified": false, "security_verified": true, "certified": false},
      "evidence": ["direct 116-block traversal", "WP-05 focused exact-selector and cursor tests", "WP-05 HTTP/MCP contract tests"], "gap": "Blind external-agent behavioral certification remains WP-16."
    },
    {
      "id": "positional_retrieval", "owner": "Advanced retrieval plus document expansion", "dependencies": ["typed locators", "exact_retrieval", "cursor_continuation"],
      "storage_or_index": ["exact-version in-memory chunk/block index", "canonical page/slide/sheet/heading metadata", "asset references"], "http": ["POST V2 document expand"], "mcp": ["get_document selector"],
      "readiness_conditions": ["format locator coverage", "selector implementation"], "completeness": "Exact declared positional scope or explicit unavailable/truncated.", "security": ["scope-bound selector", "bounded range"],
      "certification_requirements": ["page/slide/sheet/block/range/tail fixtures"],
      "states": {"code_present": true, "configured": true, "provider_ready": null, "generation_present": null, "generation_active": null, "exposed_http": true, "exposed_mcp": true, "discoverable": true, "behaviorally_verified": false, "security_verified": true, "certified": false},
      "evidence": ["DocumentExpansionServiceV2", "exact position index", "WP-05 selector/cursor/security tests"], "gap": "Format-specific positions are available only when authoritative parser metadata exists; blind behavioral certification remains WP-16."
    },
    {
      "id": "exhaustive_retrieval", "owner": "AdvancedRetrievalService", "dependencies": ["canonical/derived sources", "signed result cursor", "coverage"],
      "storage_or_index": ["authorized canonical SQLite/FTS source; later active representation indexes"], "http": ["POST /v2/retrieval/evidence"], "mcp": ["search_evidence"],
      "readiness_conditions": ["all required sources declare availability/coverage", "stable snapshot"], "completeness": "COMPLETE only after all declared sources terminate; otherwise truncated/partial/unavailable.", "security": ["scope-bound scans", "hard budgets", "signed cursor"],